{"response_contract":"response-contract-v2","scenario_id":"blackhole-dev-001-state-churn","checkpoint":50,"queries":{"q-subscriptions-current":{"assertions":[{"subject":"streamly","predicate":"status","knowledge_status":"known","value":"active","source_refs":["evt-001","evt-041"]},{"subject":"streamly","predicate":"current_price","knowledge_status":"known","value":{"amount":12.0,"currency":"EUR","billing_period":"monthly"},"source_refs":["evt-001"]},{"subject":"streamly","predicate":"price_effective","knowledge_status":"unknown","unknown_reason":"not_stated","source_refs":["evt-021"]},{"subject":"streamly","predicate":"cancellation_intent","knowledge_status":"known","value":false,"source_refs":["evt-041"]},{"subject":"streamly","predicate":"cancellation_requested","knowledge_status":"known","value":false,"source_refs":["evt-031"]}]},"q-tasks-state":{"assertions":[{"subject":"parcel_pickup_1","predicate":"status","knowledge_status":"known","value":"cancelled","source_refs":["evt-034"]},{"subject":"parcel_pickup_1","predicate":"owner","knowledge_status":"known","value":"sam","source_refs":["evt-014"]},{"subject":"parcel_pickup_1","predicate":"deadline","knowledge_status":"known","value":"2026-01-12","source_refs":["evt-004"]},{"subject":"parcel_pickup_1","predicate":"relationship","knowledge_status":"known","value":{"relation_type":"meaningful_change","source_event_id":"evt-004","target_event_id":"evt-014","changed_fields":["owner"]},"source_refs":["evt-004","evt-014"]},{"subject":"parcel_pickup_2","predicate":"status","knowledge_status":"known","value":"not_started","source_refs":["evt-044"]},{"subject":"parcel_pickup_2","predicate":"owner","knowledge_status":"known","value":"alex","source_refs":["evt-044"]},{"subject":"parcel_pickup_2","predicate":"deadline","knowledge_status":"known","value":"2026-02-25","source_refs":["evt-044"]},{"subject":"school_form_1","predicate":"status","knowledge_status":"unknown","unknown_reason":"not_stated","source_refs":["evt-017"]},{"subject":"library_return_1","predicate":"status","knowledge_status":"unknown","unknown_reason":"no_capture_for_period","source_refs":[]},{"subject":"streamly_cancellation_task","predicate":"status","knowledge_status":"known","value":"cancelled","source_refs":["evt-041"]},{"subject":"streamly_cancellation_task","predicate":"cancellation_requested","knowledge_status":"known","value":false,"source_refs":["evt-031"]},{"subject":"streamly_cancellation_task","predicate":"executed","knowledge_status":"known","value":false,"source_refs":["evt-031"]}]},"q-duplicates-changes":{"assertions":[{"subject":"capture:evt-016","predicate":"relationship","knowledge_status":"known","value":{"relation_type":"exact_duplicate","source_event_id":"evt-006","target_event_id":"evt-016"},"source_refs":["evt-006","evt-016"]},{"subject":"capture:evt-046","predicate":"relationship","knowledge_status":"known","value":{"relation_type":"exact_duplicate","source_event_id":"evt-036","target_event_id":"evt-046"},"source_refs":["evt-036","evt-046"]},{"subject":"capture:evt-026","predicate":"relationship","knowledge_status":"known","value":{"relation_type":"meaningful_change","source_event_id":"evt-006","target_event_id":"evt-026","changed_fields":["amount"]},"source_refs":["evt-006","evt-026"]},{"subject":"capture:evt-018","predicate":"relationship","knowledge_status":"known","value":{"relation_type":"meaningful_change","source_event_id":"evt-008","target_event_id":"evt-018","changed_fields":["appointment_date"]},"source_refs":["evt-008","evt-018"]},{"subject":"capture:evt-038","predicate":"relationship","knowledge_status":"known","value":{"relation_type":"meaningful_change","source_event_id":"evt-008","target_event_id":"evt-038","changed_fields":["appointment_date"]},"source_refs":["evt-008","evt-038"]},{"subject":"capture:evt-028","predicate":"relationship","knowledge_status":"known","value":{"relation_type":"similar_not_duplicate","source_event_id":"evt-018","target_event_id":"evt-028"},"source_refs":["evt-018","evt-028"]},{"subject":"scenario","predicate":"duplicate_event_count","knowledge_status":"known","value":2,"source_refs":["evt-006","evt-016","evt-036","evt-046"]},{"subject":"scenario","predicate":"duplicate_group_count","knowledge_status":"known","value":2,"source_refs":["evt-006","evt-016","evt-036","evt-046"]},{"subject":"scenario","predicate":"meaningful_change_event_count","knowledge_status":"known","value":3,"source_refs":["evt-008","evt-018","evt-026","evt-038"]}]},"q-unresolved":{"assertions":[{"subject":"streamly","predicate":"last_charge","knowledge_status":"unknown","unknown_reason":"not_stated","source_refs":["evt-011"]},{"subject":"orange_mobile","predicate":"missing_periods","knowledge_status":"known","value":["2026-04"],"source_refs":["evt-032"]},{"subject":"marketone","predicate":"explicit_zero_is_supported","knowledge_status":"known","value":false,"source_refs":["evt-033"]},{"subject":"marketone","predicate":"unobserved_consumption","knowledge_status":"unknown","unknown_reason":"no_consumption_observation","source_refs":["evt-033"]},{"subject":"jordan","predicate":"entity_link","knowledge_status":"unknown","unknown_reason":"ambiguous_person","source_refs":["evt-007","evt-017","evt-037","evt-047"]},{"subject":"bank_standing_order","predicate":"approval_required","knowledge_status":"known","value":true,"source_refs":["evt-010","evt-050"]},{"subject":"bank_standing_order","predicate":"approved","knowledge_status":"unknown","unknown_reason":"not_stated","source_refs":["evt-050"]},{"subject":"bank_standing_order","predicate":"executed","knowledge_status":"known","value":false,"source_refs":["evt-010"]},{"subject":"transfer_sam","predicate":"amount","knowledge_status":"known","value":{"amount":50.0,"currency":"EUR"},"source_refs":["evt-030"]},{"subject":"transfer_sam","predicate":"approval_required","knowledge_status":"known","value":true,"source_refs":["evt-030","evt-050"]},{"subject":"transfer_sam","predicate":"approved","knowledge_status":"unknown","unknown_reason":"not_stated","source_refs":["evt-050"]},{"subject":"transfer_sam","predicate":"executed","knowledge_status":"known","value":false,"source_refs":["evt-030"]}]}}}